{
  "contract": {
    "name": "hausman-hub-contour-apply-preview",
    "version": 1
  },
  "contour_id": "climate",
  "status": "ready",
  "ready": true,
  "room_count": 1,
  "command_count": 3,
  "changes": {
    "temperature": 1,
    "strategy": 1,
    "automatic_mode": 1
  },
  "requires_confirmation": true,
  "parameters": {
    "temperature": true,
    "strategy": true,
    "automatic_mode": true,
    "humidity": false
  },
  "limitations": ["room_humidity_command_not_supported"]
}
